"DESCRIPTION","DURATION IN MS","NAME","PARENT SUITE","START TIME","STATUS","STOP TIME","SUB SUITE","SUITE","TEST CLASS","TEST METHOD"
"","254","Client: Should successfully get profile data as Client","","Tue Apr 29 00:22:26 WIB 2025","passed","Tue Apr 29 00:22:26 WIB 2025","Profile API","Profile/getProfile.test.ts","",""
"","1200","Client: Should fail login with incorrect password","","Tue Apr 29 00:22:28 WIB 2025","passed","Tue Apr 29 00:22:29 WIB 2025","Login API","Login/login.spec.ts","",""
"","295","Admin: Should fail login when user does not exist","","Tue Apr 29 00:22:30 WIB 2025","passed","Tue Apr 29 00:22:31 WIB 2025","Login API","Login/login.spec.ts","",""
"","1695","Client: Should successfully login with valid credentials","","Tue Apr 29 00:22:26 WIB 2025","passed","Tue Apr 29 00:22:28 WIB 2025","Login API","Login/login.spec.ts","",""
"","288","Client: Should fail login when user does not exist","","Tue Apr 29 00:22:28 WIB 2025","passed","Tue Apr 29 00:22:28 WIB 2025","Login API","Login/login.spec.ts","",""
"","1188","Admin: Should fail login with incorrect password","","Tue Apr 29 00:22:31 WIB 2025","passed","Tue Apr 29 00:22:32 WIB 2025","Login API","Login/login.spec.ts","",""
"","1199","Admin: Should successfully login with valid credentials","","Tue Apr 29 00:22:29 WIB 2025","passed","Tue Apr 29 00:22:30 WIB 2025","Login API","Login/login.spec.ts","",""
"","243","Admin: Should successfully get profile data as Admin","","Tue Apr 29 00:22:29 WIB 2025","passed","Tue Apr 29 00:22:29 WIB 2025","Profile API","Profile/getProfile.test.ts","",""
